chunk_id,doc_id,filename,chunk_index,strategy,chunk_size_tokens,word_count,text
text49_semantic_0506,text49,text49.md,506,semantic,44,41,Our goal as defenders often is to craft a criminal disposition that does not hurt our client's immigration status: it does not block them from applying for lawful immigration status or take away the lawful status or protections they already have.
text49_semantic_0507,text49,text49.md,507,semantic,9,8,But there are other key goals as well.
text49_semantic_0508,text49,text49.md,508,semantic,34,31,"One is to avoid a disposition that will subject the client to a severe penalty: extended detention in ICE facilities throughout their removal proceeding, with no right to a bond hearing."
text49_semantic_0509,text49,text49.md,509,semantic,48,37,"This is called 'mandatory detention.'

Federal law requires that certain non-U.S. citizens who are in removal (deportation) proceedings shall be detained by ICE throughout those proceedings, with no right to a bond hearing or release on bond."
text49_semantic_0510,text49,text49.md,510,semantic,19,16,"The detention can go on for weeks, months, or even years if an order is appealed."
text49_semantic_0511,text49,text49.md,511,semantic,32,27,"During this time the detained person can be held anywhere in the country, in inhumane conditions, and the great majority go through their removal case without counsel."
text49_semantic_0512,text49,text49.md,512,semantic,17,16,Most immigrants subject to mandatory detention will give up their legal claim and ask for deportation.
text49_semantic_0513,text49,text49.md,513,semantic,23,19,Mandatory detention is generally triggered if the person has certain criminal convictions or comes within the 'terrorism' removal grounds.
text49_semantic_0514,text49,text49.md,514,semantic,16,8,"See INA § 236(c), 8 USC § 1226(c)."
text49_semantic_0515,text49,text49.md,515,semantic,9,8,This discussion will focus on the criminal grounds.
text49_semantic_0516,text49,text49.md,516,semantic,17,15,Defenders may be able to protect the person against mandatory detention by avoiding certain convictions.
text49_semantic_0517,text49,text49.md,517,semantic,24,20,"Defenders should consider mandatory detention triggers for all noncitizen clients, not just those who already are in removal proceedings ."
text49_semantic_0518,text49,text49.md,518,semantic,52,40,"No one is subject to any ICE detention unless they are in removal proceedings, have a prior removal order, are in the process of expedited removal, or are deemed by DHS to be 'seeking admission' (referred to as 'arriving aliens')."
text49_semantic_0519,text49,text49.md,519,semantic,37,35,"But we see many clients who are not in removal proceedings now but could end up there in the future, because they lack lawful status or will end up losing the status that they have."
text49_semantic_0520,text49,text49.md,520,semantic,17,13,"Where possible, we want to avoid mandatory detention triggers now for all noncitizens."
text49_semantic_0521,text49,text49.md,521,semantic,24,22,"To analyze what the client needs in terms of mandatory detention, first we need to determine which group the client is in."
text49_semantic_0522,text49,text49.md,522,semantic,41,27,"We will discuss them in terms of Group 1) Admitted to the U.S. and potentially deportable, and Group 2) In the U.S. without admission and potentially inadmissible."
text49_semantic_0523,text49,text49.md,523,semantic,6,4,"See Part A, above."
text49_semantic_0524,text49,text49.md,524,semantic,125,71,"Based on their group, we see which offenses will trigger mandatory detention and try to avoid those.

1. Group 1: Admitted into the U.S. with a Visa or as an LPR, and Therefore Subject to Deportation Grounds

51 Matter of Izaguirre , 27 I&amp;N Dec. 67 (BIA 2017).

52 Matter of Jackson , 26 I&amp;N Dec. 314 (BIA 2014).

53 Matter of Introcaso , 26 I&amp;N Dec. 304, 309 (BIA 2014)."
text49_semantic_0525,text49,text49.md,525,semantic,38,26,"Individuals who entered the U.S. with a visa or as LPRs, or who 'adjusted status' to LPR while they were in the U.S., have been admitted."
text49_semantic_0526,text49,text49.md,526,semantic,71,54,"In the Fifth and Ninth Circuits, some people who were 'waved in' by officials at the border also are deemed to be admitted. 54

People who were admitted and who are put in removal proceedings will be charged with being deportable , under INA § 237, 8 USC § 1227. See Section A, above."
text49_semantic_0527,text49,text49.md,527,semantic,195,160,"If the person is in removal proceedings and charged with being deportable under INA § 237, they are subject to mandatory detention if they were convicted of any of the following deportable offenses (see INA § 237(a)(2)):

- Two or more crimes involving moral turpitude (CIMT) that did not arise as part of a single scheme;
- A single CIMT that the person committed within five years of admission, for which a sentence of one year or more was imposed (this is slightly different from the CIMT deportation ground, which penalizes such a conviction with a maximum possible sentence of a year or more);
- An aggravated felony;
- Any offense relating to a federally defined controlled substance, with an exception for one or more convictions arising from a single incident involving possession for personal use of 30 grams or less of marijuana;
- A qualifying firearm offense; and
- Federal convictions relating to espionage, sabotage, treason, and similar activities."
text49_semantic_0528,text49,text49.md,528,semantic,13,4,"See INA 236(c)(1)(B), (C)."
text49_semantic_0529,text49,text49.md,529,semantic,31,27,"This list does not include two of the criminal grounds of deportability, which are the domestic violence ground (see Part E ) and the human trafficking ground."
text49_semantic_0530,text49,text49.md,530,semantic,14,5,"See INA § 237(a)(2)(E), (F)."
text49_semantic_0531,text49,text49.md,531,semantic,21,19,A person who comes within these two grounds will be deportable but will not be subject to mandatory detention.
text49_semantic_0532,text49,text49.md,532,semantic,85,63,"Individuals who entered the U.S. without being admitted and who are put in removal proceedings will be charged with being inadmissible under INA § 212, 8 USC § 1182. These people are subject to mandatory detention in either of two ways: by coming within the crimes-based (or terrorism) grounds of inadmissibility, and/or having certain pending charges or convictions under the Laken Riley Act."
text49_semantic_0533,text49,text49.md,533,semantic,46,29,"The person was not 'admitted' to the U.S. This includes:

- People who entered without inspection (EWI), meaning entered surreptitiously, avoiding inspection at the border

54 See Saldivar v."
text49_semantic_0534,text49,text49.md,534,semantic,177,130,"Sessions , 877 F.3d 812 (9th Cir. 2017) and see discussion at ILRC, Mandatory Detention , at Part II.A.1. The BIA disagrees but will apply this rule in the Fifth and Ninth Circuits.

- People who were 'paroled' into the U.S., including people who were given permission to physically enter the U.S. but were not technically 'admitted'
- If the person was not admitted but then was granted some status or protection that is less than lawful permanent residence (e.g., Temporary Protected Status (TPS), DACA, asylum), they still have not been admitted.
- § If they traveled outside the U.S. on the status and were paroled back in, they still have not been admitted.
- § If they no longer qualify for that status or protection, they may be removable."
text49_semantic_0535,text49,text49.md,535,semantic,21,18,"See the next paragraph.
- The law is unsettled on people who were granted U or T visas."
text49_semantic_0536,text49,text49.md,536,semantic,95,74,"If a person entered the U.S. with a U, T, or some other visa, they were 'admitted,' and therefore are subject to the grounds of deportability under INA § 237. But if they entered without a visa and were later granted a U or T visa while in the U.S., they might be found to be inadmissible, rather than deportable, if they lose their U or T visa status (due to expiration or revocation)."
text49_semantic_0537,text49,text49.md,537,semantic,6,4,See USCIS Policy Alert.
text49_semantic_0538,text49,text49.md,538,semantic,18,13,"But the law is unsettled, as the courts may disagree with USCIS' interpretation."
text49_semantic_0539,text49,text49.md,539,semantic,48,41,"For U and T visa holders who entered without a visa, defenders should avoid a criminal disposition that might trigger either inadmissibility or deportability, since it is unclear at this time which removal ground would apply to this group of individuals."
text49_semantic_0540,text49,text49.md,540,semantic,104,80,"The person is in removal proceedings, charged with being inadmissible under INA § 212. This group includes people who EWI'd or were paroled in, and are removable now because:

- They never obtained lawful status or protection
- They did obtain limited lawful status or protection such as TPS, asylee status, DACA, or other, but they no longer qualify for that status - for example, because TPS was ended for their country, or they were convicted of a disqualifying conviction."
text49_semantic_0541,text49,text49.md,541,semantic,25,22,They will go back to being treated as a person who was not admitted to the U.S. and who lacks lawful status.
text49_semantic_0542,text49,text49.md,542,semantic,14,13,There are two ways that these people can become subject to mandatory detention.
text49_semantic_0543,text49,text49.md,543,semantic,22,16,The first way is if the person comes within the criminal (or terrorism) grounds of inadmissibility.
text49_semantic_0544,text49,text49.md,544,semantic,17,13,The second way is if they come within the 2025 Laken Riley Act.
text49_semantic_0545,text49,text49.md,545,semantic,290,232,"A person in removal proceedings under INA § 212 is subject to mandatory detention if they come within any of the following crimes-based grounds of inadmissibility at INA § 212(a)(2):

- A conviction of, or qualifying admission to immigration authorities that they committed, one crime involving moral turpitude (CIMT), unless it comes within the petty offense or youthful offender exception (see Part D, CIMTs);
- A conviction of, or a qualifying admission to immigration authorities that they committed, an offense relating to a federally defined controlled substance (see Part F , Controlled Substances);
- Conviction of two or more offenses of any kind with a total sentence imposed of at least five years (see Part I, Sentencing);

- Being found to have engaged in prostitution in the last ten years or coming to the U.S. to engage in prostitution or commercialized vice.
- Immigration authorities know or have 'reason to believe' that the person aided or participated in:
- § Trafficking in a controlled substance (plus certain family members who benefitted from this) (see Part F , Controlled Substances);
- § Severe trafficking in persons (plus certain family members who benefitted from this);
- § Money laundering;
- Foreign government officials who committed severe violations of religious freedom;

This section will review the Laken Riley Act (LRA), its effect on California offenses, and suggestions for defense strategies in criminal and immigration proceedings."
text49_semantic_0546,text49,text49.md,546,semantic,52,37,"For further discussion, see the useful NIPNLG Practice Alert on the LRA and see ILRC, Understanding Mandatory Detention . 55

WARNING: LRA was enacted in 2025 and it is not yet clear how it will be interpreted."
text49_semantic_0547,text49,text49.md,547,semantic,22,18,"It imposes mandatory detention based on very minor factors such as being charged with shoplifting, theft, or burglary."
text49_semantic_0548,text49,text49.md,548,semantic,24,21,The best defense will be if criminal court defenders can strategize with their clients about how to avoid these LRA triggers.
text49_semantic_0549,text49,text49.md,549,semantic,36,34,"Your client can try to fight a finding of mandatory detention based on a complex legal defense, but they will do it while detained by ICE and in many cases without access to counsel."
text49_semantic_0550,text49,text49.md,550,semantic,27,20,"As of January 29, 2025, certain immigrants are subject to mandatory detention if they come within provisions of the LRA."
text49_semantic_0551,text49,text49.md,551,semantic,38,32,"This applies to immigrants who are in the U.S. without having been admitted , for example because they entered without being inspected at the border ('entered without inspection') or were paroled in."
text49_semantic_0552,text49,text49.md,552,semantic,64,49,"It applies to some people seeking entry at the border. 56 The LRA does not apply to LPRs, nor to other individuals who have been admitted into the U.S. who would be placed in removal proceedings charged with being deportable under INA § 237, as discussed above in (A)(5)."
text49_semantic_0553,text49,text49.md,553,semantic,237,137,"It created a new subsection of the INA 57 that imposes mandatory detention if the person:

is charged with, is arrested for, is convicted of, admits having committed, or admits committing acts which constitute the essential elements of any burglary, theft, larceny, shoplifting, or assault of a law enforcement officer offense, or any crime that results in death or serious bodily injury to another person.

55 See NIPNLG, The Laken Riley Act's Mandatory Detention Provisions (February 5, 2025), https://nipnlg.org/sites/default/files/2025-02/Alert-Laken-Riley-Act.pdf and see ILRC, Understanding Mandatory Detention (Dec. 2025) at www.ilrc.org/crimes-summaries.

56 INA § 236(c)(1)(E)(i) states that these provisions apply to a person who 'is inadmissible under paragraph (6)(A), (6)(C), or (7) of section 1182(a) of this title.' This may include people have sought admission at the border but have no valid passport or visa (e.g. many asylum seekers)."
text49_semantic_0554,text49,text49.md,554,semantic,16,15,This should not apply to someone who already has been admitted by using visa fraud.
text49_semantic_0555,text49,text49.md,555,semantic,103,69,"Because that person was admitted, even illegally, they are subject to removal based on a charge of deportability, i.e., they are in what we are calling Group 1. Additionally, although an LPR with certain convictions can be charged with inadmissibility after travel abroad, they would still not fall under LRA because they would not be inadmissible under these specific grounds.

57 See INA § 236(c)(1)(E), 8 USC § 1226(c)(1)(E)."
text49_semantic_0556,text49,text49.md,556,semantic,27,20,The above offenses have 'the meanings given such terms in the jurisdiction in which the acts occurred.' INA § 236(c)(2).
text49_semantic_0557,text49,text49.md,557,semantic,29,21,"In other words, 'burglary' for this purpose is defined by California PC § 459, not by a federal definition of burglary."
text49_semantic_0558,text49,text49.md,558,semantic,71,54,"The named LRA offenses are 'burglary, theft, larceny, shoplifting, or assault of a law enforcement officer, or any crime that results in death or serious bodily injury to another person.' When translated to the California penal code, this affects many different statutes; see the Chart for alerts on specific offenses that may trigger LRA."
text49_semantic_0559,text49,text49.md,559,semantic,16,15,This section will recommend alternative pleas and provide ideas for arguments for removal defense activists.
text49_semantic_0560,text49,text49.md,560,semantic,28,21,"Unfortunately, some of the LRA offenses are important 'immigration-neutral' alternative pleas that defenders have used for years to avoid immigration consequences."
text49_semantic_0561,text49,text49.md,561,semantic,52,29,"For example, sections 459 (burglary), 191.5 (vehicular manslaughter), and 192(b) (involuntary manslaughter) all are offenses that do not make the person inadmissible, but now they will trigger mandatory detention."
text49_semantic_0562,text49,text49.md,562,semantic,37,34,"So, even though these offenses could be a good choice to keep the client eligible to apply for immigration relief, that must be weighed against the terrible effect of being detained throughout the proceedings."
text49_semantic_0563,text49,text49.md,563,semantic,11,9,"If there is a hard choice, consult an expert."
text49_semantic_0564,text49,text49.md,564,semantic,14,12,"For more information on each of the below offenses, see the Chart."
text49_semantic_0565,text49,text49.md,565,semantic,23,19,"Note: If nothing else, a plea to attempt or conspiracy to commit the below offenses might avoid the LRA."
text49_semantic_0566,text49,text49.md,566,semantic,38,31,"The LRA does not list 'attempt,' and at least one district court has suggested that conviction for attempt does not cause mandatory detention under the LRA. 58 Conspiracy is another option."
text49_semantic_0567,text49,text49.md,567,semantic,6,4,There are two caveats.
text49_semantic_0568,text49,text49.md,568,semantic,47,36,"First, if the offense is immigration-neutral because it can be committed by recklessness or negligence (see, e.g., PC 192(a)), a plea to attempt will destroy that defense by making the conduct intentional in the Ninth Circuit."
text49_semantic_0569,text49,text49.md,569,semantic,30,20,"Second, until there is a published decision on 'attempt' or 'conspiracy' and the LRA, each immigrant must litigate this defense."
text49_semantic_0570,text49,text49.md,570,semantic,11,8,"That may be impossible for detained, unrepresented people."
text49_semantic_0571,text49,text49.md,571,semantic,20,17,"So, a plea to attempt or conspiracy is far better than nothing, but it is no guarantee."
text49_semantic_0572,text49,text49.md,572,semantic,34,21,"Sections 459.5, 459, 484, and offenses that use the PC 484 definition such as PC 487, all come within the LRA."
text49_semantic_0573,text49,text49.md,573,semantic,11,9,"To avoid this, defenders should seek an alternative disposition."
text49_semantic_0574,text49,text49.md,574,semantic,20,17,Removal defense advocates need to be able to argue that the alternative does not trigger the LRA.
text49_semantic_0575,text49,text49.md,575,semantic,7,6,Plead to an unrelated offense .
text49_semantic_0576,text49,text49.md,576,semantic,26,24,The best alternative plea is an offense that has nothing to do with theft or burglary and clearly does not come within the LRA.
text49_semantic_0577,text49,text49.md,577,semantic,42,35,Consider any misdemeanor or felony that does not come within the crimes inadmissibility grounds (because that also would trigger mandatory detention for this group) and that hopefully does not otherwise harm the person's immigration situation.
text49_semantic_0578,text49,text49.md,578,semantic,61,41,"Likely options would be loitering or trespass as in PC § 647(h), 602, 602.5, 594, or (if the sentence will be under a year) PC 32. These alternatives also do not permit the jailer to transfer the person straight to ICE."
text49_semantic_0579,text49,text49.md,579,semantic,23,17,"See Part L, Protections Against Law Enforcement Cooperation with ICE.)

Plead to a similar but distinguishable offense."
text49_semantic_0580,text49,text49.md,580,semantic,27,23,"These may ultimately not be subject to LRA, but ICE likely will allege that they trigger mandatory detention, so they will require litigation."
text49_semantic_0581,text49,text49.md,581,semantic,11,8,"Until there is a published

58 Salgado v."
text49_semantic_0582,text49,text49.md,582,semantic,29,9,"Francis , No. 25-CV-6524 (VEC), 2025 WL 2806757 (S.D.N.Y."
text49_semantic_0583,text49,text49.md,583,semantic,27,17,"Oct. 1, 2025).

decision upholding the defense, they may be of little use to unrepresented detained immigrants."
text49_semantic_0584,text49,text49.md,584,semantic,13,12,This section includes ideas for removal defense advocates who argue these cases.
text49_semantic_0585,text49,text49.md,585,semantic,33,26,"The goal is to find offenses that avoid the California definition of theft at PC 484. (In California, larceny is defined as the same as theft."
text49_semantic_0586,text49,text49.md,586,semantic,170,120,"PC 490a.) Under PC 484, the essential elements of theft by larceny are: (1) the defendant took possession of personal property owned by someone else; (2) the defendant did so without the owner's consent; (3) when the defendant took the property, he or she intended to deprive the owner of it permanently or substantially; and (4) the defendant moved the property, even a small distance, and kept it for any period of time. 59

Receipt of stolen property , PC 496, 496d : In California, PC 496 and related offenses (e.g. 496.5, 496.6) are listed in the larceny chapter of the penal code but describe receipt or possession of stolen property, which arguably is not a theft or larceny offense."
text49_semantic_0587,text49,text49.md,587,semantic,83,60,"Numerous California courts have clarified the distinction between PC 496 and theft/larceny. 60 Theft requires a taking and carrying away, not receiving, or possessing items that have been stolen. 61 Furthermore, theft under PC 484(a) requires an intent to deprive the owner permanently or substantially, while PC 496, 496d can be committed with intent to deprive the owner only temporarily."
text49_semantic_0588,text49,text49.md,588,semantic,117,77,"Immigration cases have long recognized this distinction. 62

Vehicle Taking, VC 10851 may be a taking, but it is not a 'theft' offense because it can involve only a temporary taking or driving of a vehicle, while California theft requires intent to permanently or substantially deprive the owner of the property. 63

Identity theft, PC 530.5(a), (d)(2), or false personation, PC 529(a)(3): Section 530.5(a) prohibits obtaining another's personal identifying information and using it for any unlawful purpose."
text49_semantic_0589,text49,text49.md,589,semantic,29,25,"It does not require any intent to deprive or defraud the person or gain any tangible benefit, and it does not require that any resulted."
text49_semantic_0590,text49,text49.md,590,semantic,38,26,"Identity theft is not actually a theft offense: the information did not have to be unlawfully obtained, just unlawfully used. 64 Section 529(a)(3) has similar advantages."
text49_semantic_0591,text49,text49.md,591,semantic,6,5,See discussion in the Chart.
text49_semantic_0592,text49,text49.md,592,semantic,30,24,"Defenders should conservatively assume that any conviction of assault or battery against any law enforcement officer, including offensive touching without injury, triggers the LRA."
text49_semantic_0593,text49,text49.md,593,semantic,31,22,"Defenders can consider the following alternatives and immigration advocates can make the following arguments.

59 CalCrim No. 1800. See also People v."
text49_semantic_0594,text49,text49.md,594,semantic,24,9,"Catley (2007) 148 Cal.App.4th 500, 505.

60 See e.g."
text49_semantic_0595,text49,text49.md,595,semantic,3,2,People v.
text49_semantic_0596,text49,text49.md,596,semantic,33,18,"Tyler (1968) 258 Cal.App.2d 661, 667 (receiving stolen property is not within the offense of burglary); People v."
text49_semantic_0597,text49,text49.md,597,semantic,53,24,"Moore ((1963) 220 Cal.App.2d 737, 740; In re Stanley (1928) 90 Cal.App. 132, 134-136 (not the same as or included in larceny); People v."
text49_semantic_0598,text49,text49.md,598,semantic,23,9,"Ward (1895) 105 Cal. 652, 659-660 (same) People v."
text49_semantic_0599,text49,text49.md,599,semantic,25,9,"Disperati (1909) 11 Cal.App. 469, 481-482 (same); People v."
text49_semantic_0600,text49,text49.md,600,semantic,67,35,"Hall (1985) 168 Cal.App.3d 624, 626 (same).

61 ''Taking,' as required for larceny, has two aspects: (1) achieving possession of the property, known as 'caption,' and (2) carrying the property away, or 'asportation.' People v."
text49_semantic_0601,text49,text49.md,601,semantic,56,21,"Gomez (2008) 74 Cal.Rptr.3d 123, 43 Cal.4th 249, 179 P.3d 917, habeas corpus dismissed 2009 WL 1481115.

62 See Castillo-Cruz v."
text49_semantic_0602,text49,text49.md,602,semantic,37,13,"Holder , 581 F.3d 1154, 1161 (9th Cir. 2009) (PC 496(a)); Alvarez-Reynaga v."
text49_semantic_0603,text49,text49.md,603,semantic,32,14,"Holder , 596 F.3d 534 (9th Cir. 2010) (PC 496d(a))

63 See People v."
text49_semantic_0604,text49,text49.md,604,semantic,46,26,"Bullard (2020), 9 Cal.5th 94, 103-4 (VC 10851 is broader than theft and does not distinguish between intent to permanently or only temporarily deprive); People v."
text49_semantic_0605,text49,text49.md,605,semantic,32,16,"Davis, (1998) 19 Cal.4th 301, 305 (theft in CA requires intent to permanently deprive); People v."
text49_semantic_0606,text49,text49.md,606,semantic,30,13,"Butler (1967) 65 Cal.2d 569, 572-573, overruled on other grounds by People v."
text49_semantic_0607,text49,text49.md,607,semantic,56,36,"Tufunga (1999) 21 Cal.4th 935, 956, ('The taking of property is not theft in the absence of an intent to steal … i.e., an intent to deprive an owner permanently of his property').

64 People v."
text49_semantic_0608,text49,text49.md,608,semantic,107,71,"Jimenez (2020) 9 Cal.5th 53, 63.

- Bargain to drop the assault offense and plead to other conduct that also occurred, e.g., PC 370, 415, 594. These are not within the LRA and should not require litigation.
- Plead to PC 148(a)(1), which can be committed without assault, threat, or touch - for example, by going limp during an arrest at a peaceful demonstration. 65 Hopefully this will not require litigation."
text49_semantic_0609,text49,text49.md,609,semantic,32,20,"Do not plead to PC 69.
- § Sections 148(a)(2), (3), removing an officer's weapon, also do not require assault."
